{
  "label": "USDCx",
  "caption": "Circle USDC bridge for Cardano",
  "summary": "xReserve-backed bridge bringing Circle USDC to Cardano, operated by IOG.",
  "description": "USDCx is Circle's xReserve-based bridge between Cardano and Ethereum. Cardano-side burns release native USDC from xReserve on Ethereum. Operated by IOG, with off-chain attester infrastructure by Anastasia Labs.",
  "category": "DEFI",
  "subCategory": "WRAPPED_ASSETS",
  "link": {
    "website": "https://usdcx.iog.io",
    "github": "https://github.com/input-output-hk"
  },
  "scripts": [
    { "name": "USDCx Mint Policy", "scriptHash": "1f3aec8bfe7ea4fe14c5f121e2a92e301afe414147860d557cac7e34", "purpose": "MINT", "type": "PLUTUS", "plutusVersion": 3 },
    { "name": "Bridge Processor", "scriptHash": "a3d5052864638828bc3fbc0d5b9a4223e233620d7911a5376ed4b658", "purpose": "SPEND/MINT", "type": "PLUTUS", "plutusVersion": 3 },
    { "name": "Operator (withdraw-zero validator)", "scriptHash": "d74de93a7e4940462c4509f59c712889422506f8b63dcfd0c266dc7b", "purpose": "WITHDRAW", "type": "PLUTUS", "plutusVersion": 3 },
    { "name": "Config / Parameters", "scriptHash": "d2c3f66c2c7154d9f0b913ee3cd9b0a25bbb7d1537953d7c36c07e86", "purpose": "SPEND", "type": "PLUTUS", "plutusVersion": 3 }
  ]
}
