{
  "label": "Chilled Kongs",
  "caption": "",
  "summary": "The Chilled Kongs OG is a limited collection of 8,888 NFTS on Cardano Blockchain",
  "description": "The Chilled Kongs OG is a limited collection of 8,888 NFTS on Cardano Blockchain",
  "category": "COLLECTION",
  "subCategory": "NFT",
  "link": {
    "x": "https://x.com/ChilledKongs",
    "website": "https://chilledkongs.com"
  },
  "scriptMappings": {
    "names": {},
    "purposes": {}
  }
}
