{
  "label": "CSWAP",
  "caption": "",
  "summary": "The Progressive Protocol that merges DEX with NFTfi",
  "description": "The Progressive Protocol that merges DEX with NFTfi",
  "category": "DEFI",
  "subCategory": "DEX",
  "link": {
    "x": "https://x.com/CswapDEX",
    "discord": "https://discord.gg/JNFDH8ENd5",
    "reddit": "https://www.reddit.com/r/CswapDEX/",
    "telegram": "https://t.me/cswapdex",
    "medium": "https://medium.com/@cswapdex",
    "website": "https://www.cswap.fi"
  },
  "scripts": [
    { "name": "V3 Pool", "scriptHash": "ed97e0a1394724bb7cb94f20acf627abc253694c92b88bf8fb4b7f6f", "purpose": "SPEND", "type": "PLUTUS", "plutusVersion": 3 }
  ],
  "scriptMappings": {
    "names": {
      "OriginsStaking": "Origins Staking"
    },
    "purposes": {
      "OriginsStaking": "SPEND"
    }
  }
}
