{
  "label": "Indigo Protocol",
  "branding": {
    "color": "#ffffff",
    "bgColor": "#490cb5"
  },
  "caption": "",
  "summary": "The Indigo Protocol (INDY) is a decentralized synthetic assets protocol built on the Cardano blockchain. It allows users to mint and trade synthetic assets, such as iUSD, iBTC, and iETH, which mirror the value of real-world assets like the US dollar, Bitcoin, and Ethereum, respectively.",
  "description": "An autonomous synthetics protocol for on-chain price exposure to real-world assets, built on Cardano blockchain",
  "category": "DEFI",
  "subCategory": "SYNTHETICS",
  "link": {
    "x": "https://x.com/Indigo_protocol",
    "telegram": "https://t.me/indigo_protocol",
    "discord": "https://discord.com/invite/gVqDRNg7VH",
    "medium": "https://indigoprotocol1.medium.com/",
    "reddit": "https://www.reddit.com/r/indigoprotocol/",
    "website": "https://indigoprotocol.io"
  },
  "scripts": [
    {
      "name": "CDP",
      "scriptHash": "0805d8541db33f4841585fed4c3a7e87e2ff7018243038f06ceb660c",
      "purpose": "SPEND",
      "type": "PLUTUS",
      "plutusVersion": 2
    },
    {
      "name": "Stability Pool",
      "scriptHash": "88e0299018563dd10c4860d9f34eda56fdb77f302da0e3980620535c",
      "purpose": "SPEND",
      "type": "PLUTUS",
      "plutusVersion": 2
    },
    {
      "name": "CDP Creator",
      "scriptHash": "0910f79461a71f74782dcd450f22b0c2cac31ab036b66c9219355d99",
      "purpose": "SPEND",
      "type": "PLUTUS",
      "plutusVersion": 2
    },
    {
      "name": "Treasury",
      "scriptHash": "3bd5f8ba0100f39952472619abfddb52d941a5347b88635e874a7b37",
      "purpose": "SPEND",
      "type": "PLUTUS",
      "plutusVersion": 2
    },
    {
      "name": "Redemption Order Book",
      "scriptHash": "519e4d36b834dcf62dacb8c0c978787435cf5981b59f3dc39c55a7b7",
      "purpose": "SPEND",
      "type": "PLUTUS",
      "plutusVersion": 2
    },
    {
      "name": "Version Registry",
      "scriptHash": "ea84d625650d066e1645e3e81d9c70a73f9ed837bd96dc49850ae744",
      "purpose": "SPEND",
      "type": "PLUTUS",
      "plutusVersion": 2
    },
    {
      "name": "Governance (V2)",
      "scriptHash": "131f26cd99012663aa063d0ef86dc0ac039d1797d5e062768fb12e74",
      "purpose": "SPEND",
      "type": "PLUTUS",
      "plutusVersion": 2
    },
    {
      "name": "Poll Shard (V2)",
      "scriptHash": "8110c6ae9c92962f01ce98611656c05ea69aa5a709f4ea89c588bbdb",
      "purpose": "SPEND",
      "type": "PLUTUS",
      "plutusVersion": 2
    }
  ],
  "scriptMappings": {
    "names": {
      "Stabilitypool": "Stability pool",
      "iUSD": "iUSD",
      "iBTC": "iBTC",
      "iETH": "iETH",
      "Indystaking": "Indy staking",
      "CDP": "CDP",
      "Stabilitypoolaccount": "Stability pool account",
      "CDPcreator": "CDP creator",
      "PollManager": "Poll Manager",
      "PollManagerupgrade": "Poll Manager upgrade",
      "DEXLPtokenstaking": "DEX LP token staking",
      "Upgrade": "Upgrade",
      "iAssetsmintingpolicy": "iAssets minting policy",
      "CDPmintingpolicy": "CDP minting policy",
      "SPAccountmintingpolicy": "SP Account minting policy",
      "Stakingpositionmintingpolicy": "Staking position minting policy",
      "PollManagermintingpolicy": "Poll Manager minting policy",
      "Upgrademintingpolicy": "Upgrade minting policy",
      "FeeCollector": "Fee Collector",
      "INDYstaking": "INDY staking",
      "StabilityPool": "Stability Pool",
      "CDPCreator": "CDP Creator"
    },
    "purposes": {
      "Stabilitypool": "SPEND",
      "iUSD": "SPEND",
      "iBTC": "SPEND",
      "iETH": "SPEND",
      "Indystaking": "SPEND",
      "CDP": "SPEND",
      "Stabilitypoolaccount": "SPEND",
      "CDPcreator": "SPEND",
      "PollManager": "SPEND",
      "PollManagerupgrade": "SPEND",
      "DEXLPtokenstaking": "SPEND",
      "Upgrade": "SPEND",
      "iAssetsmintingpolicy": "MINT",
      "CDPmintingpolicy": "MINT",
      "SPAccountmintingpolicy": "MINT",
      "Stakingpositionmintingpolicy": "MINT",
      "PollManagermintingpolicy": "MINT",
      "Upgrademintingpolicy": "MINT",
      "FeeCollector": "SPEND",
      "INDYstaking": "SPEND",
      "StabilityPool": "SPEND",
      "CDPCreator": "SPEND"
    }
  }
}
