{
  "label": "ADAX PRO",
  "caption": "",
  "summary": "Decentralized Exchange Protocol Built on the Cardano Network",
  "description": "Decentralized Exchange Protocol Built on the Cardano Network",
  "category": "DEFI",
  "subCategory": "AMM_DEX",
  "link": {
    "x": "https://x.com/adax_pro",
    "website": "https://adax.pro"
  },
  "scriptMappings": {
    "names": {
      "unclassified1": "unclassified1",
      "unclassified2": "unclassified2",
      "unclassified3": "unclassified3",
      "unclassified4": "unclassified4",
      "unclassified5": "unclassified5",
      "unclassified6": "unclassified6",
      "unclassified7": "unclassified7",
      "unclassified8": "unclassified8",
      "unclassified9": "unclassified9",
      "unclassified10": "unclassified10",
      "unclassified11": "unclassified11",
      "unclassified12": "unclassified12",
      "unclassified13": "unclassified13",
      "unclassified14": "unclassified14",
      "unclassified15": "unclassified15",
      "unclassified16": "unclassified16",
      "unclassified17": "unclassified17",
      "unclassified18": "unclassified18",
      "unclassified19": "unclassified19",
      "unclassified20": "unclassified20",
      "unclassified21": "unclassified21",
      "unclassified22": "unclassified22",
      "unclassified23": "unclassified23",
      "unclassified24": "unclassified24",
      "unclassified25": "unclassified25",
      "unclassified26": "unclassified26",
      "unclassified27": "unclassified27",
      "unclassified28": "unclassified28",
      "unclassified29": "unclassified29",
      "unclassified30": "unclassified30",
      "unclassified31": "unclassified31",
      "unclassified32": "unclassified32",
      "batchercontract": "batcher contract",
      "poolcontract": "pool contract",
      "factorypolicy": "factory policy",
      "lppolicy": "lp policy",
      "pooluniquenessNFTpolicy": "pool uniqueness NFT policy",
      "coinpolicy": "coin policy",
      "timepolicy": "time policy",
      "NFTpolicy": "NFT policy",
      "farmingcontract": "farming contract"
    },
    "purposes": {
      "unclassified1": "SPEND",
      "unclassified2": "SPEND",
      "unclassified3": "SPEND",
      "unclassified4": "SPEND",
      "unclassified5": "SPEND",
      "unclassified6": "SPEND",
      "unclassified7": "SPEND",
      "unclassified8": "SPEND",
      "unclassified9": "SPEND",
      "unclassified10": "SPEND",
      "unclassified11": "SPEND",
      "unclassified12": "SPEND",
      "unclassified13": "SPEND",
      "unclassified14": "SPEND",
      "unclassified15": "SPEND",
      "unclassified16": "SPEND",
      "unclassified17": "SPEND",
      "unclassified18": "SPEND",
      "unclassified19": "SPEND",
      "unclassified20": "SPEND",
      "unclassified21": "SPEND",
      "unclassified22": "SPEND",
      "unclassified23": "SPEND",
      "unclassified24": "SPEND",
      "unclassified25": "SPEND",
      "unclassified26": "SPEND",
      "unclassified27": "SPEND",
      "unclassified28": "SPEND",
      "unclassified29": "SPEND",
      "unclassified30": "SPEND",
      "unclassified31": "SPEND",
      "unclassified32": "SPEND",
      "batchercontract": "SPEND",
      "poolcontract": "SPEND",
      "factorypolicy": "MINT",
      "lppolicy": "MINT",
      "pooluniquenessNFTpolicy": "MINT",
      "coinpolicy": "MINT",
      "timepolicy": "MINT",
      "NFTpolicy": "MINT",
      "farmingcontract": "SPEND"
    }
  }
}
